{
 "schema_version": 1,
 "slice_id": "calc.media.v1",
 "contract_hash": "sha256:3a7bd3e2360a3d29eea436fcfb7e44c735d117c42d1c1835420b6b9942dd4f1b",
 "matches": false,
 "discrepancies": [
  {
   "clause": "NaN in the list",
   "intent_says": "a NaN in xs is a caller error",
   "contract_implies": "S* says nothing about NaN: media([nan]) may return nan"
  }
 ]
}
